{
  "schemaVersion": 1,
  "evidenceType": "play-16kb-device",
  "captureMethod": "adb-and-play-console",
  "packageName": "com.personal.alarmpyo",
  "versionName": "1.19",
  "versionCode": 19,
  "aabSha256": "aaaaaaaaaaaaaaaaaaaaaaaaaaaaaaaaaaaaaaaaaaaaaaaaaaaaaaaaaaaaaaaa",
  "sourceCommit": "bbbbbbbbbbbbbbbbbbbbbbbbbbbbbbbbbbbbbbbb",
  "easBuildId": "11111111-1111-4111-8111-111111111111",
  "checkedAt": "2026-08-24T10:30:00.000Z",
  "device": {
    "deviceType": "emulator",
    "sdk": 35,
    "pageSizeBytes": 16384,
    "buildFingerprint": "adb shell getprop ro.build.fingerprint 결과"
  },
  "delivery": {
    "source": "play-app-bundle-explorer",
    "splitApks": true,
    "zipalign16Kb": false,
    "elfLoadSegments16Kb": false,
    "signingCertificateSha256": "ffffffffffffffffffffffffffffffffffffffffffffffffffffffffffffffff"
  },
  "checks": {
    "installAndLaunch": false,
    "coreScheduleFlow": false,
    "alarmWhileClosed": false,
    "alarmAfterReboot": false,
    "timerWhileClosed": false,
    "timerAfterReboot": false,
    "timerPauseResumeReset": false,
    "fullScreenAlarm": false,
    "widgetAvailable": false,
    "patternVaultFlow": false
  }
}
